1,https://static.garfield.dale.ro/1995/ga950102.gif,You know what the world needs? - More sugary treats! - Love! What are you? Some kind of a nut?
2,https://static.garfield.dale.ro/1995/ga950103.gif,"Bad news, Garfield. I forgot to buy cat food! - Oh, no! - Whatever will I do?"
3,https://static.garfield.dale.ro/1995/ga950104.gif,"Here you go, Jon! - I'm not your pet! You're mine! - And furthermore...is that turkey?"
4,https://static.garfield.dale.ro/1995/ga950105.gif,"- Sigh - This, obviously, is not my hat."
5,https://static.garfield.dale.ro/1995/ga950106.gif,? - Every sweater I own is missing. - Warm at last.
6,https://static.garfield.dale.ro/1995/ga950107.gif,Do you think I'm funny? - HA! HA! HA! HA! HA! HA! - Sorry. I thought you were kidding.
8,https://static.garfield.dale.ro/1995/ga950109.gif,- - Found a spider in the freezer.
9,https://static.garfield.dale.ro/1995/ga950110.gif,Spider race! - WHAP! - The winner!
10,https://static.garfield.dale.ro/1995/ga950111.gif,cough cough - How about a cough drop? WHAP - Those things really work.
11,https://static.garfield.dale.ro/1995/ga950112.gif,- SWAT! - heh heh heh This is not a good sign.
12,https://static.garfield.dale.ro/1995/ga950113.gif,"O.K. Garfield, pretend I'm a mouse. - I'm running across the room. What do you do? - Take me to your cheese."
13,https://static.garfield.dale.ro/1995/ga950114.gif,- What's this? - A list of things I'm NOT going to do today!
15,https://static.garfield.dale.ro/1995/ga950116.gif,- - You're not very cheerful today. - You missed it.
16,https://static.garfield.dale.ro/1995/ga950117.gif,"- What a beautiful, sunny day! -"
17,https://static.garfield.dale.ro/1995/ga950118.gif,"- You are a dolt. You ar eugly, and you are generally unacceptable. - They love attention."
18,https://static.garfield.dale.ro/1995/ga950119.gif,BLAGOONGA! - Blaoonga? - Odie needs tuning.
19,https://static.garfield.dale.ro/1995/ga950120.gif,"Jane, congratulations! You have won the grand prize! - A night out with Jon Arbuckle! - She'd rather have a dishwasher. Counter with a bun warmer."
20,https://static.garfield.dale.ro/1995/ga950121.gif,"What do you think of when you see a beautiful scene like this, Garfield? - Pizza. - And that stump over there reminds me of a lasagna."
22,https://static.garfield.dale.ro/1995/ga950123.gif,Coffee? - - Your guess is as good mine.
23,https://static.garfield.dale.ro/1995/ga950124.gif,"Is your coffee too strong, Garfield? - I don't know. - Before I could taste it, it got up and walked away."
24,https://static.garfield.dale.ro/1995/ga950125.gif,"Be careful, Garfield. - That coffee is hot. - Thanks for the warning."
25,https://static.garfield.dale.ro/1995/ga950126.gif,One more sip of coffee would probably be a mistake. - - I know my caffeine.
26,https://static.garfield.dale.ro/1995/ga950127.gif,"Jon says if I run fast, I can avoid exercise! - * - Waaaaaait a second."
27,https://static.garfield.dale.ro/1995/ga950128.gif,"Look! I brought you a nice, juicy bone! - I'll leave it here, just out of your reach. - Enjoy!"
29,https://static.garfield.dale.ro/1995/ga950130.gif,"I'm reading about the pioneers. Like my crazy great-grandfather, Oslo. - He moved his family thousands of miles across uncharted territory. - They were very brave. ""I hear a can opener,"" he kept saying."
30,https://static.garfield.dale.ro/1995/ga950131.gif,"Jon, did you say I should, or should NOT stop bothering you? - GO AWAY! - Not until you answer my question."
31,https://static.garfield.dale.ro/1995/ga950201.gif,"Oh, great. A new mouse hole. - plit - What's that? Standard lease agreement."
32,https://static.garfield.dale.ro/1995/ga950202.gif,I'm improving my mind. - You should try it sometime. Okay. - Now what can I do to improve Jon's mind?
33,https://static.garfield.dale.ro/1995/ga950203.gif,Beware Of The Old Dog - What are you going to do? Gum me? - That geezer's lethal with a cane.
34,https://static.garfield.dale.ro/1995/ga950204.gif,"Ah, that was a great meal. - scrape scrape scrape scrape - By, golly, he's right."
36,https://static.garfield.dale.ro/1995/ga950206.gif,? - tap tap tap -
37,https://static.garfield.dale.ro/1995/ga950207.gif,"The Cat Channel presents everyone's favorite game show... - ""Sleeping For Dollars!"" - Z Z Z Z Z I love sports."
38,https://static.garfield.dale.ro/1995/ga950208.gif,"Z - Z click - Eighteen hours, nine minutes. Roll me over. I can do better!"
39,https://static.garfield.dale.ro/1995/ga950209.gif,I wish I were asleep. - You ARe asleep. - Then that explains that. Z
40,https://static.garfield.dale.ro/1995/ga950210.gif,"I know what you want, Garfield. - I can read your mind. - You want food! Sure, and by the way, your car's on fire."
41,https://static.garfield.dale.ro/1995/ga950211.gif,For diner you are having some disgusting glop I made from who knows what. - - All right!
43,https://static.garfield.dale.ro/1995/ga950213.gif,AARRRGH! - I have cat hair all over me! brush brush brush - Join the club.
44,https://static.garfield.dale.ro/1995/ga950214.gif,You're shedding. AM NOT! - - snip snip
45,https://static.garfield.dale.ro/1995/ga950215.gif,"Well if this isn't ""Mister Gluttony"" - How are you, ""Mister I Think I'll Eat Two Dozen Doughnuts In One Sitting""? - Taking a nap ""Mister Stuff My Face Till I Pass Out""? Just don't call me ""Mister Lardo""."
46,https://static.garfield.dale.ro/1995/ga950216.gif,Garfield has a bad habit of. - How about this weather? - Interrupting me.
47,https://static.garfield.dale.ro/1995/ga950217.gif,- - Did it suddenly get stupider in here?
48,https://static.garfield.dale.ro/1995/ga950218.gif,- - I can't wait for spring.
50,https://static.garfield.dale.ro/1995/ga950220.gif,"What happened to all the aluminium foil? - - Disgiused as a leftover, Garfield? Shhhh! You'll spook the meatloaf!"
51,https://static.garfield.dale.ro/1995/ga950221.gif,The Loch Ness cat surfaces. - He surveys his territory. - And spies a diet on the horizon.
52,https://static.garfield.dale.ro/1995/ga950222.gif,"You have a bad attitude about this diet, Garfield. - To successfully diet, you have to want to diet. - It's hard to find a reason to diet when your wardrobe always fits."
53,https://static.garfield.dale.ro/1995/ga950223.gif,Jon's right! I'm going to approach this diet with a positive mental attitude! - With a smile on my face. - And a frown in my stomach.
54,https://static.garfield.dale.ro/1995/ga950224.gif,"Don't eat those doughnuts! You're on a diet, Garfield! - I won't eat 'em, I'll swear! - I JUST WANT TO RUB THEM ALL OVER MY BODY!"
55,https://static.garfield.dale.ro/1995/ga950225.gif,- AAARRGHH - So how did you do on your diet? Let's just say I won't be wearing bikini briefs to the beach anytime soon.
57,https://static.garfield.dale.ro/1995/ga950227.gif,Garfield was real grumpy this morning. - So I sent him out for a nice walk... - Which seems to have done some good! I maimed three squirrels.
58,https://static.garfield.dale.ro/1995/ga950228.gif,"Hello, fatso. - Hello, shredded shirt. -"
59,https://static.garfield.dale.ro/1995/ga950301.gif,I've never been in better shape in my life! - *I* have! - I guess I topped him!
60,https://static.garfield.dale.ro/1995/ga950302.gif,"You're lazy, Garfield. I happen to be conducting a scientific experiment, thank you. - Lazy, lazy. I'm testing the first law of physics... - Lazy, lazy, lazy, lazy! ""Bodies at rest tend to stay at rest""."
61,https://static.garfield.dale.ro/1995/ga950303.gif,Woof woof  Meow meow Blah-dee-blah-dee-dah - Hee hee hee hee hee - Small talk.
62,https://static.garfield.dale.ro/1995/ga950304.gif,I always like to make sure Odie and I have the exact same amount of food. - -
64,https://static.garfield.dale.ro/1995/ga950306.gif,"It's Power Pooky! Duh, duh, duh, duuuuuuuh! - Able to stave off loneliness in a single hug! - You don't need big muscles to be a super hero."
65,https://static.garfield.dale.ro/1995/ga950307.gif,"- *SQUEEEEZE - You never hug ME like that. With all due respect, you're no teddy bear."
66,https://static.garfield.dale.ro/1995/ga950308.gif,Sigh - HUGGG - Thanks. No problem.
67,https://static.garfield.dale.ro/1995/ga950309.gif,"How was your meal, Garfield? Fine, thanks. - And how about you, Pooky? Are you STUFFED? - I'm not even going to dignify that with a grin."
68,https://static.garfield.dale.ro/1995/ga950310.gif,"That concludes tonight's program. - Next on ""nature world""... - The bear...friend of man? Or vicious killer?"
69,https://static.garfield.dale.ro/1995/ga950311.gif,"What do you want to do today, Pooky? - PLOP - Not much with words, but what an idea man!"
71,https://static.garfield.dale.ro/1995/ga950313.gif,"All cats love to play in paper bags! Go on, try it! - - Am I having fun yet? SEE?!"
72,https://static.garfield.dale.ro/1995/ga950314.gif,"- I can wait, bird. - Sooner or later, you've gotta come out of there again."
73,https://static.garfield.dale.ro/1995/ga950315.gif,- TWIST -
74,https://static.garfield.dale.ro/1995/ga950316.gif,"- Cream in your coffee, Garfield? - I'M SORRY! DID I OFFEND YOUR SENSE OF AESTHETICS?!"
75,https://static.garfield.dale.ro/1995/ga950317.gif,Z - Click! Z - Hey! I was watching that!
76,https://static.garfield.dale.ro/1995/ga950318.gif,- ATTENTION! STEP AWAY FROM THE BURGER! STEP AWAY FROM THE BURGER! - WOOP WOOP WOOP WOOP A BURGER Alarm! Ah-HA
78,https://static.garfield.dale.ro/1995/ga950320.gif,"I'm calling the travel agency to plan our vacation. - Hello, Donna? Jon Arbuckle. I wanna go somewhere tropical and cheap...great! Book 'em Donna! - Pack your bags, ol' buddy. We are going to the island of Guano-Guano! Why is it I have the"
79,https://static.garfield.dale.ro/1995/ga950321.gif,"Well, I'M ready to start our vacation. - Are you packed yet, Garfield? - All set."
80,https://static.garfield.dale.ro/1995/ga950322.gif,"As usual, Garfield, I'm going to have to dress you up to take you on the airplane. - Well, I guess this outfit isn't so bad... - Considering..."
81,https://static.garfield.dale.ro/1995/ga950323.gif,"Where's Odie? I hop he's okay. - Relax, Jon. How much trouble could he get into on a plane?"
82,https://static.garfield.dale.ro/1995/ga950324.gif,I wonder how you make these seats recline. - Maybe this little button does the trick. - Nope. That's not it.
83,https://static.garfield.dale.ro/1995/ga950325.gif,- The captain apologizes for the slight turbulence. - This also concludes the meal portion of your flight.
85,https://static.garfield.dale.ro/1995/ga950327.gif,"Well, here we are in beautiful Guano-Guano, guys! - Look, a native! ALOHA, DUDE! - Aloha, this! Uh, must be an obscure Guano-Guano greeting. No, I think that's pretty universal."
86,https://static.garfield.dale.ro/1995/ga950328.gif,"We'd like a room, please. - Sorry, we don't allow pets. - Very well, he'll sleep in the car."
87,https://static.garfield.dale.ro/1995/ga950329.gif,"Hey, where's the bed in this room? - SLAM! - Here it is, Jon. ...Jon?"
88,https://static.garfield.dale.ro/1995/ga950330.gif,"Let's hit the beach! What the? - Natives here wear palm fronds, so I'm going to blend right in! - When in Rome, do as the Romans do! So this is dorkland."
89,https://static.garfield.dale.ro/1995/ga950331.gif,"You going to a costume party? - I thought people from Guano-Guano wore palm fronds. Not since the investation of leaf weasels. - WOAH! HEY! WOAH! MUNCH CHOMP MUNCH Kind of sad, isn't it? Not ot mention indecent."
90,https://static.garfield.dale.ro/1995/ga950401.gif,"Look, Garfield, a sheell. Jon. - If you put this on your ear, you can hear the ocean! Uh...Jon? - Isn't that the shell of the spiny screaming death crab?"
92,https://static.garfield.dale.ro/1995/ga950403.gif,"Springtime is here! Lock the door. - It's time for our traditional greeting! Oh no! - HELLO, MISTER SPRINGTIME!! This is the lowest point of the year."
93,https://static.garfield.dale.ro/1995/ga950404.gif,- SHOONK - Mow the lawn!
94,https://static.garfield.dale.ro/1995/ga950405.gif,"Beware Of The Artistic Dog - Yeah, right. -"
95,https://static.garfield.dale.ro/1995/ga950406.gif,"- - That floor is pretty cold this morning, isn't it?"
96,https://static.garfield.dale.ro/1995/ga950407.gif,"Chapter one: ""Encouraging your cat to exercise"". - - Chapter two: ""Meet mister Cattle Prod"". I think I'll sleep in the car."
97,https://static.garfield.dale.ro/1995/ga950408.gif,TLOK TLOK SMACK SMACK SMACK SMACK - TLOK TLOK SMACK SMACK SMACK SMACK - Psst! Odie! Want some more peanut butter?
99,https://static.garfield.dale.ro/1995/ga950410.gif,"People think I'm boring. - That's not entirely true, Jon. - Cats think you're boring, too."
100,https://static.garfield.dale.ro/1995/ga950411.gif,"And now, to demonstrate dog's amazing tracking ability, here's Odie! - - Yo! Over here! This way!"
101,https://static.garfield.dale.ro/1995/ga950412.gif,Help! The walls are closing in on me! - Oh...never mind. - Walk into a closet again? Smart guy.
102,https://static.garfield.dale.ro/1995/ga950413.gif,"It's time for the weather! - But, there was no weather today! - Hey! This job is easy when you don't get out of your chair. Tell me about it."
103,https://static.garfield.dale.ro/1995/ga950414.gif,Jon's mother made him a new sweater. - And he looks great in it! - There doesn't seem to be an opening for my head. Like I said...
104,https://static.garfield.dale.ro/1995/ga950415.gif,"Faithful Odie, always cheerful...so loving... - And faithful Garfield, always so...soo.. Yes? - There. Thank you! Thank you!"
106,https://static.garfield.dale.ro/1995/ga950417.gif,- Cats are supposed to chase mice. - Fascinating! Tell me more about cats!
107,https://static.garfield.dale.ro/1995/ga950418.gif,"Chase the mouse! - Jon, Jon, Jon... - How can I chase him if he isn't moving?"
108,https://static.garfield.dale.ro/1995/ga950419.gif,"Can you reach the mouse, Garfield? - No. - But I can reach his refrigerator!"
109,https://static.garfield.dale.ro/1995/ga950420.gif,"Jon, I'm circulating a petition asking that the mouse move out. - I might even sign it myself. - Yes, nature can be cruel."
110,https://static.garfield.dale.ro/1995/ga950421.gif,"WAP! EEK! WAP! EEK! WAP! EEK! WAP! EEK! WAP! EEK! - Uh, Garfield... WAP! EEK! WAP! EEK! WAP! EEK! - Yes?"
111,https://static.garfield.dale.ro/1995/ga950422.gif,"- - C'mon, mouse...let go! Say ""Pretty please with a cherry on top""."
113,https://static.garfield.dale.ro/1995/ga950424.gif,- Lousy weather we're having. - Not if you don't get out of bed!
114,https://static.garfield.dale.ro/1995/ga950425.gif,Can you birds come out to play? - Sure! - Right after we finish eating these juicy worms! Never mind.
115,https://static.garfield.dale.ro/1995/ga950426.gif,Garfield... - Did you drop this bowling ball? - Me?
116,https://static.garfield.dale.ro/1995/ga950427.gif,"BOOT! - - In case you were wondering, the paint's not dry yet."
117,https://static.garfield.dale.ro/1995/ga950428.gif,The news is too depressing. - So tonight I'll read a comic book instead! - Zombies from Venus are invading earth? - Film at eleven.
118,https://static.garfield.dale.ro/1995/ga950429.gif,Hmmm. Interesting lettuce. - - There's a phrase you don't hear every day.
120,https://static.garfield.dale.ro/1995/ga950501.gif,I'm tired. - Not only can't I hold my eyes open... - I can barely hold someone else's eyes open.
121,https://static.garfield.dale.ro/1995/ga950502.gif,- - I'm hiding from Odie.
122,https://static.garfield.dale.ro/1995/ga950503.gif,Do not take the lid off this jar! - - I took the jar off the lid!
123,https://static.garfield.dale.ro/1995/ga950504.gif,"How have I been? I'm fine, thank me. - Well, I look good. Thank me for saying so. - Tell me, what have I been up to? I hate it when his guests don't show up."
124,https://static.garfield.dale.ro/1995/ga950505.gif,"I'm in a playful mood. - And when I'm in a playful mood, that can mean only one thing! - Chess by mail! Do you feel that? That's electricity in the air!"
125,https://static.garfield.dale.ro/1995/ga950506.gif,Yawn - Oooooo - YAWN Show-off.
127,https://static.garfield.dale.ro/1995/ga950508.gif,"There are your global disasters... - There are your national emergencies... - And then there's Jon. Well, I was flossing, and..."
128,https://static.garfield.dale.ro/1995/ga950509.gif,"I can't sleep. - Here it is, 3 A.M., and I'm still wide awake. - You can't possibly realize how annoying that is."
129,https://static.garfield.dale.ro/1995/ga950510.gif,"Marcia, if you're not busy tonight... - I'd like to treat you to a movie. - Well, I was thinking of going too... There's always a catch."
130,https://static.garfield.dale.ro/1995/ga950511.gif,"You are fat, Garfield! - No I'm not! - Your stomach is snowcapped. I was standing too close to the freezer, okay?!"
131,https://static.garfield.dale.ro/1995/ga950512.gif,Z - I feel safer when he's asleep. - BONK! Z
132,https://static.garfield.dale.ro/1995/ga950513.gif,I put a bell around Garfield's neck. - Now I'll be able to tell where he is. - Ha! Ha!
134,https://static.garfield.dale.ro/1995/ga950515.gif,"Did you know that spiders aren't insect? - WHAM! - Funny, they squish like insects."
135,https://static.garfield.dale.ro/1995/ga950516.gif,- - Now THAT'S a strong cup of coffee.
136,https://static.garfield.dale.ro/1995/ga950517.gif,"smack! - SMACK! - Hey! What happened to ""The Far Side""?"
137,https://static.garfield.dale.ro/1995/ga950518.gif,Geronimo! - - I'm not getting enough sleep.
138,https://static.garfield.dale.ro/1995/ga950519.gif,- - tappity tappity tappity
139,https://static.garfield.dale.ro/1995/ga950520.gif,* lap lap lap lap - lap lap lap - burrrrp
141,https://static.garfield.dale.ro/1995/ga950522.gif,Dog: man's best friend. - Man: dog's best friend. - YOU DESERVE EACH OTHER!
142,https://static.garfield.dale.ro/1995/ga950523.gif,"The National Nonviolent Network... - proudly presents... - ""Balloon Toss at The O.K. Corral"". I can't watch!"
143,https://static.garfield.dale.ro/1995/ga950524.gif,"Garfield, see wht this tastes like. - Tastes like an old hyena! - It's old hyena. Then why don't I feel like laughing?"
144,https://static.garfield.dale.ro/1995/ga950525.gif,Ah! Snack food! - Potato chips and sparrows! - What have you got there? Potato chips and stuff.
145,https://static.garfield.dale.ro/1995/ga950526.gif,"Z - OGGGG YESSS, IT'S A BEEEAUTIFUL MORNING!! - That's one bubble I can't wait to burst."
146,https://static.garfield.dale.ro/1995/ga950527.gif,Do you ever feel like you just have to get up and get out? - Happened last week. - I sat on a ferret.
148,https://static.garfield.dale.ro/1995/ga950529.gif,"Greetings, folks! I...um...um... - Never hire a dog as a cue card boy. -"
149,https://static.garfield.dale.ro/1995/ga950530.gif,TAPPITY TAPPITY TAPPITY TAPPITY - BONK! - I want that usher's name!
150,https://static.garfield.dale.ro/1995/ga950531.gif,"A funny thing happened on the way to the fence tonight. I walked up to this chihuahua and asked him for five bucks. - He said, ""Sorry, I'm a little short right now""! - No, I kid chihuahuas! Seriously, they're a beautiful breed of rat, I mean"
151,https://static.garfield.dale.ro/1995/ga950601.gif,I know why you people don't get my jokes! You're not hip! You're too old! - Why don't you all go home? Isn't it past your bedtime?! - KONK!
152,https://static.garfield.dale.ro/1995/ga950602.gif,"Maestro, if you please... - ** Ahem...in my key, please. - ** Thank you."
153,https://static.garfield.dale.ro/1995/ga950603.gif,"You wouldn't hit a cat with glasses, would you? - SPLAT! SPLUT SPLIT SPLOT SPLAT SPLOT SPLOT SPLUT! -"
155,https://static.garfield.dale.ro/1995/ga950605.gif,"Poor Jon, sitting there so peacefully. - I really should stop harassing him. - But first I have to get rid of this brick."
156,https://static.garfield.dale.ro/1995/ga950606.gif,- SHOOM! -
157,https://static.garfield.dale.ro/1995/ga950607.gif,YAWN - YAWN - We do our own stunts.
158,https://static.garfield.dale.ro/1995/ga950608.gif,"To keep Garfield from taking cookies, I have installed a surveillance camera. - - Hey! Where's my camera?! Stole it. Sold it. Bought more cookies."
159,https://static.garfield.dale.ro/1995/ga950609.gif,I'm a talking bird! - And you are a fat. ugly cat! - Who is no longer hungry.
160,https://static.garfield.dale.ro/1995/ga950610.gif,Coming up next... - Advanced drape clawing techniques. - Educational T.V.!
162,https://static.garfield.dale.ro/1995/ga950612.gif,"- OH, NO! - My birthday is right around the corner!"
163,https://static.garfield.dale.ro/1995/ga950613.gif,"How does it feel to be turning 17, Garfield? Great! - I'm learning something new every day! - And forgetting two old things."
164,https://static.garfield.dale.ro/1995/ga950614.gif,"I'm not aging, I'm maturing. - - Okay, so I'm aging."
165,https://static.garfield.dale.ro/1995/ga950615.gif,"If you tell me how old you're going to be next week, I promise not to laugh. - Seventeen. - I would have preferred the laugh."
166,https://static.garfield.dale.ro/1995/ga950616.gif,"There are lots of advantaged to growing older! There's, uh... - -"
167,https://static.garfield.dale.ro/1995/ga950617.gif,Well! How nice! - A birthday card. - Thanks. Sa' right.
169,https://static.garfield.dale.ro/1995/ga950619.gif,WOOOOOSH - - Happy 17th. Practice! That was practice!
170,https://static.garfield.dale.ro/1995/ga950620.gif,Z - Wow. Z - He got out of bed today. Z
171,https://static.garfield.dale.ro/1995/ga950621.gif,- It would be nice to see you two cooperating. - I guess I asked for it.
172,https://static.garfield.dale.ro/1995/ga950622.gif,"Do not damage the new couch! Okay! - CRASH! BAM! SMASH! - Destroyed everything BUT the couch, right? Everything."
173,https://static.garfield.dale.ro/1995/ga950623.gif,Beware Of The Dog - And His Little Fiend - Mr. Wolverine That does it.
174,https://static.garfield.dale.ro/1995/ga950624.gif,"They put a proverb under each yearbook picture. - Euphemia Hinkle: ! A penny saved is a penny earned"". - Jon Arbuckle: ""A fool and his money are soon parted""."
176,https://static.garfield.dale.ro/1995/ga950626.gif,Reserved - - I'm a regular here.
177,https://static.garfield.dale.ro/1995/ga950627.gif,"I might as well relax till I get rescued from this tree. Cats always get rescued. - - Buuuuut, what do I know?"
178,https://static.garfield.dale.ro/1995/ga950628.gif,"Windy today. - SCHWAP! - ""Gemini: today you will reach new heights""."
179,https://static.garfield.dale.ro/1995/ga950629.gif,Here comes the fire department! - I'm saved! - SQIRRRRT
180,https://static.garfield.dale.ro/1995/ga950630.gif,Stuck up in a tree again. - WHY do I stupid things like this?! - And that.
181,https://static.garfield.dale.ro/1995/ga950701.gif,It's Jon! I'm saved! - B-D-D-D-D-D - My hero.
183,https://static.garfield.dale.ro/1995/ga950703.gif,"Today's the day we start a new roll of paper towels! - Hey, pal. Are you okay? Oh, I don't know, Jon. I so looked forward to this, and now that it's here, I guess I'm suffering from post-paper towel depressin... Heeey, are you picking on me?"
184,https://static.garfield.dale.ro/1995/ga950704.gif,It wouldn't hurt you to go out and get a little sun! - I'll go out. - But I refuse to get any sun!
185,https://static.garfield.dale.ro/1995/ga950705.gif,I'm going to show the world I'm not lazy! - - If SOMEONE would please open the door for me. tap tap tap
186,https://static.garfield.dale.ro/1995/ga950706.gif,"Lasagna, Garfield? I'd die for this guy. - It's low calorie. GULP - And one-third the fat. Then bring me two more, dip wad."
187,https://static.garfield.dale.ro/1995/ga950707.gif,"Tonight the National Cat Channel presents... - An unwanted dog's tragic journey... - ""Old drooler meets the electric fence"". I should be taping this."
188,https://static.garfield.dale.ro/1995/ga950708.gif,"Here, Odie! Here, Odie! - Garfield, is Odie outside? Mostly. -"
190,https://static.garfield.dale.ro/1995/ga950710.gif,"Everything around here is mine, mine, mine! - - Make me an offer."
191,https://static.garfield.dale.ro/1995/ga950711.gif,Everything is gray and dull. - - I just realized I haven't dusted in 17 years. Aha.
192,https://static.garfield.dale.ro/1995/ga950712.gif,"Is that the best you can do? Belly to the ground! - LOAF, mister! LOAF! - I'm Odie's trainer."
193,https://static.garfield.dale.ro/1995/ga950713.gif,Sigh... - Today is 2.3% more than yesterday. - I have a great deal of experience in this area.
194,https://static.garfield.dale.ro/1995/ga950714.gif,"- Come on, Garfield! There's a big, wonderful world out there! - I prefer my small, crummy world, thank you."
195,https://static.garfield.dale.ro/1995/ga950715.gif,"It's the weekend, and you know what that means... - Two words, Garfield... - ""Board Games"". Whoa! My fun meter is a-jumpin' off the scale!"
197,https://static.garfield.dale.ro/1995/ga950717.gif,"My uncle Ed was big on etiquette. - ""Never belch out loud,"" he always said. - Then one day he blew out an eyeball."
198,https://static.garfield.dale.ro/1995/ga950718.gif,"BOOT! - - Don't tell me...you're doing something different with your hair, right?"
199,https://static.garfield.dale.ro/1995/ga950719.gif,I wonder if I'm just too sophisticated for my own good. - Excellent question. - Let's ask your bunny slippers what they think.
200,https://static.garfield.dale.ro/1995/ga950720.gif,"Garfield! Dinner! - THHHHHHUUCK!! - What took you so long? It's a hot day, and that was a vinyl armchair."
201,https://static.garfield.dale.ro/1995/ga950721.gif,Nothing unpleasant has happened all day. - SPLUT! - All you had to do was ask.
202,https://static.garfield.dale.ro/1995/ga950722.gif,- STOP IT! STOP IT! STOP IT! - Weirdo.
204,https://static.garfield.dale.ro/1995/ga950724.gif,"Suzy the canary, missing october '78... - Spanky the goldfish, missing november `81. - Raymond the poisonous toad... Raymond I remember."
205,https://static.garfield.dale.ro/1995/ga950725.gif,"Say ""when"". - - That was the last bag. In that case, ""when""."
